{
  "schema_version": "state_survival_macrospin_v1",
  "packet_id": "a1b2c3d4e5f6a7b8c9d0e1f2a3b4c5d6e7f8a9b0c1d2e3f4a5b6c7d8e9f0a1b2",
  "timestamp": "2024-01-15T10:30:00.000Z",
  "spin_configuration": {
    "lattice_size": {
      "x": 4,
      "y": 4
    },
    "spins": [
      1, 1, 1, 1,
      1, 0, 0, 1,
      1, 0, 0, 1,
      1, 1, 1, 1
    ]
  },
  "nearest_neighbors": {
    "interaction_strength": -1.0,
    "boundary_conditions": "periodic"
  },
  "metadata": {
    "temperature": 300.0,
    "external_field": 0.0,
    "evolution_time": 100.0
  }
}
